{
  "assignment": {
    "train": [
      "guardrail.yaml",
      "normal.yaml",
      "precedence-repo-noqa-format-train.yaml"
    ],
    "selection": [
      "commit-includes-terse-why.yaml",
      "closes-when-fully-satisfied.yaml"
    ],
    "test": [
      "edge.yaml",
      "no-auto-generated-adr.yaml",
      "no-bulk-rewrite.yaml",
      "no-redundant-what-comment.yaml",
      "no-staleness-only-deletion.yaml",
      "refs-when-partial-work.yaml",
      "precedence-informal-convention-not-deterministic-selection.yaml",
      "commit-why-keeps-distinct-reasons.yaml",
      "why-not-issue-and-adr-numbers-stay-distinct.yaml"
    ]
  },
  "partition": "3:2:9",
  "split_arithmetic_exclusions": [],
  "equivalence_classes": [
    {
      "train_fixture": "precedence-repo-noqa-format-train.yaml",
      "held_out_fixture": "precedence-informal-convention-not-deterministic-selection.yaml"
    }
  ]
}
